video_id,index,no_list,time,categories,part
1009,45,"[350, 351, 352, 353, 354, 355, 356]","['00:37:32,679', '00:38:18,919']",[],"This is John hirsh on his ancestors built a wall here four [hundred] [and] [forty] years ago and close by Towers have other family names like the chant our the wang towel the law tower, so we're here We have the family history of the great [wall] still living on 440 Years after it was built Even today they still worship their ancestors by celebrating ancient festivals [man], the Pig was closed yesterday should be quite nice fresh [for]"
1009,46,"[357, 358, 359, 360, 361, 362, 363]","['00:38:21,570', '00:39:34,579']",[],"It would have been a rare moment of relaxation and abundance in a hard life As the oldest member of his family Mr.. General makes the sacrifice to his ancestors and burns incense sticks [yeah], [ok] [any] the living generations of the junk family bowed to the dead and to their own great mystery? The Village families had to look after and feed the soldiers in the tablets There take away food service survives to this day Janish and Farmer down in transient Village prepared some delicacies for me"
1009,47,"[364, 365, 366, 367, 368, 369, 370, 371, 372, 373, 374, 375, 376, 377]","['00:39:35,699', '00:40:32,690']","[['/Food & Drink', 0.5099999904632568]]",Munch on up here after my hike And it's amazing to think that 400 years ago Guards [Garrison] up on the wall will be sent these [lobbying] by their families so look It's a kind of pasty caps Fresh in one of these large Oak leaves [you] can see the leaf prints on the pastry [ever] taste Hmm follow tribes Kind of try and try this hamburger. Maybe the original Chinese takeaway for those up on the wall [yeah] by
1009,48,"[378, 379, 380, 381, 382, 383]","['00:40:32,690', '00:41:09,538']",[],"1644 just short of a hundred Years of construction the most impressive defensive wall ever made by man was finished however, it was not one single [great] [wall] it comprised a system of several Defense lines from the Mountains to the sea In 2009 after a national survey of the ming wall Chinese officials announced that the total length is 8850 Kilometers This is the end Chug one meaning Mountain see parts"
1009,49,"[384, 385, 386, 387, 388, 389]","['00:41:14,909', '00:41:51,858']","[['/Online Communities/Virtual Worlds', 0.6600000262260437], ['/Arts & Entertainment', 0.6200000047683716], ['/Games/Roleplaying Games', 0.5299999713897705], ['/Games/Online Games/Massively Multiplayer Games', 0.5199999809265137]]",the Chinese like in the [main] great [walls] [were] [dragons] sneaking across their land and here it comes to a Geographical and that's all dragons had [of] the [Loc] Not far from this location in 1644 the commander of Shanghai [guan] faced his biggest challenge An event which [led] to the end of the great wall functioning as a national defense Professor one is taking William to the gates and walls in the outskirts of shang one This is the place where the great [wall] story came to an end
1009,50,"[390, 391, 392, 393, 394, 395, 396, 397]","['00:41:54,329', '00:42:28,860']","[['/Reference/Humanities/History', 0.550000011920929]]",The construction of the great wall led to the financial and strategic collapse of the Ming Dynasty Revolts broke out everywhere in the Empire An Army of Rebel peasants marched on beijing where they toppled the emperor? Then on to Shanghai [Guan] the last stronghold of the ming Empire But a mighty army had risen from the steps heading for the middle Kingdom the Manchus Caught in between some [Wii]. He was the general in command of the fortress of [suge] one Now he was under siege
1009,51,"[398, 399, 400, 401, 402, 403]","['00:42:30,929', '00:43:06,528']",[],"What would he do this was a powerful Garrison that wasn't strong enough to fight off attackers on [two] friends [yeah] [lightyear] not having to do about [that] [beef] when professor want to know about tells [when] [you're] [missing] the solution he found [on] gravity for the old one so trapped between Two enemies commander was angry. [I] knew he couldn't defeat them both, so we came up with a plan to offer a alliance Treaty with the Manchus in the North and the two armies joined and"
1009,52,"[404, 405, 406, 407, 408, 409, 410, 411]","['00:43:07,259', '00:43:49,099']","[['/Reference/Humanities/History', 0.9200000166893005]]","Confronted the [peasant] rebel army and they defeated them the wall is only as strong as the men who guard it Genghis Khan is supposed to have said his successes from the steps the Manchus would have agreed with 80,000 Manchu soldiers pass through this gate and answered the Heartland of China the Manchus founded a new Dynasty which in effect ruled over the Middle Kingdom until Nineteen Twelve They call themselves [ching] meaning the pure And the great wall is of no use anymore"
1009,53,"[412, 413, 414, 415, 416, 417, 418]","['00:43:50,760', '00:44:27,380']",[],But its story did not come to an end Even today nobody knows how long all the great walls of China really are There are still many more walls and stories to be discovered And [William] [Lindsay] will not stop walking the great wall until he knows them I don't think in future and so many people will be organized in such a methodical way To create something that was not just history that not just fell apart [but] is left as part of the geography of China and the world
